001:006:000:DESCRIPTOR         1613848604.269725
 05 0D 09 02 A1 01 85 01 09 20 A1 00 09 42 09 44
 09 45 09 3C 09 32 15 00 25 01 75 01 95 05 81 02
 95 03 81 03 05 01 09 30 75 10 95 01 A4 55 0D 65
 11 15 00 26 00 46 35 00 46 00 46 81 02 09 31 15
 00 26 00 28 35 00 46 00 28 81 02 B4 05 0D 09 30
 15 00 26 FF 1F 35 00 46 FF 1F 81 02 09 3D 15 A6
 25 5A 75 08 95 01 81 02 09 3E 15 A6 25 5A 81 02
 C0 C0 05 0D 09 02 A1 01 85 02 09 01 A1 00 05 09
 19 01 29 06 15 00 25 01 75 01 95 06 81 02 75 02
 95 01 81 03 05 01 09 30 15 00 26 00 46 35 00 46
 00 46 75 10 95 01 81 02 09 31 15 00 26 00 28 35
 00 46 00 28 75 10 95 01 81 02 09 30 15 00 26 FF
 1F 35 00 46 FF 1F 75 10 95 01 81 02 09 40 75 08
 95 03 15 00 26 FF 00 B1 02 C0 C0 06 00 FF 09 01
 A1 01 85 04 09 02 75 08 95 07 15 00 26 FF 00 81
 02 C0

